Mesh Block,Other scales,Variable,Description,Data type,Aggregation scale
203,198,dist_m_pub_osm,"Average distance to closest pub (OSM, October 2018)",float,All scales
204,199,dist_m_public_swimming_pool_osm,"Average distance to closest public swimming pool (OSM, October 2018)",float,All scales
205,200,dist_m_restaurant_osm,"Average distance to closest restaurant (OSM, October 2018)",float,All scales
206,201,dist_m_secondary_schools,"Average distance to closest schools (secondary; ACARA, 2018)",float,All scales
207,202,dist_m_secondary_schools_catholic,"Average distance to closest schools (secondary, Catholic; ACARA, 2018)",float,All scales
208,203,dist_m_secondary_schools_gov,"Average distance to closest schools (secondary, Government; ACARA, 2018)",float,All scales
209,204,dist_m_secondary_schools_indep,"Average distance to closest schools (secondary, Independent; ACARA, 2018)",float,All scales
210,205,dist_m_special_schools,"Average distance to closest schools (special; ACARA, 2018)",float,All scales
211,206,dist_m_supermarket,Average distance to closest supermarket (in house 2017),float,All scales
212,207,dist_m_supermarket_osm,"Average distance to closest supermarket (OSM, October 2018)",float,All scales
213,208,dist_m_theatre_osm,"Average distance to closest theatre (OSM, October 2018)",float,All scales
